{
  "$schema": "https://json-schema.org/draft/2020-12/schema",
  "$id": "https://github.com/crypta-network/cryptad/tools/release-certification/schemas/stable-1.0-vulnerability-disclosure-policy-v1.schema.json",
  "title": "Cryptad Stable 1.0 vulnerability disclosure policy v1",
  "type": "object",
  "additionalProperties": false,
  "required": [
    "schemaVersion",
    "kind",
    "policyEdition",
    "repositoryIdentity",
    "stableMilestone",
    "effectiveAt",
    "severityVocabulary",
    "confidenceVocabulary",
    "exploitabilityVocabulary",
    "urgencyVocabulary",
    "caseStates",
    "transitions",
    "affectedScopeTypes",
    "embargoStates",
    "obligationTypes",
    "severityPolicies",
    "extensionPolicy",
    "criticalRules",
    "preTriageBlockingPolicy",
    "requiredEvidenceByIncidentClass",
    "allowedReleaseLanes",
    "disclosurePrerequisites",
    "closurePrerequisites",
    "publicProjectionRules",
    "reporterCreditRules",
    "externalIdentifierRules",
    "artifactBounds",
    "retentionRules",
    "redactionRestrictions",
    "policyDigest"
  ],
  "properties": {
    "schemaVersion": {
      "const": 1
    },
    "kind": {
      "const": "stable-1.0-vulnerability-disclosure-policy"
    },
    "policyEdition": {
      "const": 1
    },
    "repositoryIdentity": {
      "const": "github.com/crypta-network/cryptad"
    },
    "stableMilestone": {
      "const": "1.0"
    },
    "effectiveAt": {
      "type": "string",
      "format": "date-time"
    },
    "severityVocabulary": {
      "type": "array",
      "minItems": 4,
      "maxItems": 4,
      "uniqueItems": true,
      "items": {
        "$ref": "stable-1.0-vulnerability-common-v1.schema.json#/$defs/strictSeverity"
      }
    },
    "confidenceVocabulary": {
      "type": "array",
      "minItems": 4,
      "maxItems": 4,
      "uniqueItems": true,
      "items": {
        "$ref": "stable-1.0-vulnerability-common-v1.schema.json#/$defs/confidence"
      }
    },
    "exploitabilityVocabulary": {
      "type": "array",
      "minItems": 5,
      "maxItems": 5,
      "uniqueItems": true,
      "items": {
        "$ref": "stable-1.0-vulnerability-common-v1.schema.json#/$defs/exploitability"
      }
    },
    "urgencyVocabulary": {
      "type": "array",
      "minItems": 3,
      "maxItems": 3,
      "uniqueItems": true,
      "items": {
        "$ref": "stable-1.0-vulnerability-common-v1.schema.json#/$defs/urgency"
      }
    },
    "caseStates": {
      "type": "array",
      "minItems": 14,
      "maxItems": 14,
      "uniqueItems": true,
      "items": {
        "$ref": "stable-1.0-vulnerability-common-v1.schema.json#/$defs/caseState"
      }
    },
    "transitions": {
      "type": "array",
      "minItems": 14,
      "maxItems": 14,
      "uniqueItems": true,
      "items": {
        "type": "object",
        "additionalProperties": false,
        "required": [
          "from",
          "to"
        ],
        "properties": {
          "from": {
            "$ref": "stable-1.0-vulnerability-common-v1.schema.json#/$defs/caseState"
          },
          "to": {
            "$ref": "stable-1.0-vulnerability-common-v1.schema.json#/$defs/caseState"
          }
        }
      }
    },
    "affectedScopeTypes": {
      "type": "array",
      "minItems": 16,
      "maxItems": 16,
      "uniqueItems": true,
      "items": {
        "type": "string",
        "minLength": 3,
        "maxLength": 64
      }
    },
    "embargoStates": {
      "type": "array",
      "minItems": 5,
      "maxItems": 5,
      "uniqueItems": true,
      "items": {
        "$ref": "stable-1.0-vulnerability-common-v1.schema.json#/$defs/embargoState"
      }
    },
    "obligationTypes": {
      "type": "array",
      "minItems": 25,
      "maxItems": 25,
      "uniqueItems": true,
      "items": {
        "type": "string",
        "minLength": 3,
        "maxLength": 64
      }
    },
    "severityPolicies": {
      "type": "array",
      "minItems": 4,
      "maxItems": 4,
      "items": {
        "$ref": "#/$defs/severityPolicy"
      }
    },
    "extensionPolicy": {
      "$ref": "#/$defs/extensionPolicy"
    },
    "criticalRules": {
      "type": "array",
      "minItems": 7,
      "maxItems": 16,
      "uniqueItems": true,
      "items": {
        "$ref": "stable-1.0-vulnerability-common-v1.schema.json#/$defs/referenceId"
      }
    },
    "preTriageBlockingPolicy": {
      "type": "object",
      "additionalProperties": false,
      "required": ["severities", "deadlineNames"],
      "properties": {
        "severities": {
          "type": "array",
          "minItems": 1,
          "maxItems": 4,
          "uniqueItems": true,
          "items": {
            "$ref": "stable-1.0-vulnerability-common-v1.schema.json#/$defs/strictSeverity"
          }
        },
        "deadlineNames": {
          "type": "array",
          "minItems": 1,
          "maxItems": 3,
          "uniqueItems": true,
          "items": {
            "enum": [
              "acknowledgementDueAt",
              "triageDueAt",
              "remediationDecisionDueAt"
            ]
          }
        }
      }
    },
    "requiredEvidenceByIncidentClass": {
      "type": "array",
      "minItems": 6,
      "maxItems": 32,
      "items": {
        "$ref": "#/$defs/incidentEvidence"
      }
    },
    "allowedReleaseLanes": {
      "type": "array",
      "minItems": 4,
      "maxItems": 4,
      "items": {
        "$ref": "#/$defs/releaseLanePolicy"
      }
    },
    "disclosurePrerequisites": {
      "$ref": "#/$defs/stringSet"
    },
    "closurePrerequisites": {
      "$ref": "#/$defs/stringSet"
    },
    "publicProjectionRules": {
      "$ref": "#/$defs/projectionRules"
    },
    "reporterCreditRules": {
      "$ref": "#/$defs/creditRules"
    },
    "externalIdentifierRules": {
      "$ref": "#/$defs/externalRules"
    },
    "artifactBounds": {
      "$ref": "#/$defs/artifactBounds"
    },
    "retentionRules": {
      "$ref": "#/$defs/retentionRules"
    },
    "redactionRestrictions": {
      "$ref": "#/$defs/redactionRules"
    },
    "policyDigest": {
      "$ref": "stable-1.0-vulnerability-common-v1.schema.json#/$defs/digest"
    }
  },
  "$defs": {
    "artifactBounds": {
      "type": "object",
      "additionalProperties": false,
      "required": [
        "maximumCases",
        "maximumLedgerBytes",
        "maximumTransitionsPerCase",
        "maximumObligationsPerCase",
        "maximumPostReleaseChecks",
        "maximumAffectedScopeRows",
        "maximumExternalIdentifiers",
        "maximumStringBytes",
        "maximumProtectedAttachmentReferences",
        "maximumProtectedAttachmentBytes",
        "evaluationClockMaximumSkewSeconds",
        "freshObservationMaximumAgeHours",
        "summaryMaximumAgeHours"
      ],
      "properties": {
        "maximumCases": {
          "type": "integer",
          "minimum": 1,
          "maximum": 4096
        },
        "maximumLedgerBytes": {
          "const": 16777216
        },
        "maximumTransitionsPerCase": {
          "type": "integer",
          "minimum": 14,
          "maximum": 128
        },
        "maximumObligationsPerCase": {
          "type": "integer",
          "minimum": 1,
          "maximum": 256
        },
        "maximumPostReleaseChecks": {
          "type": "integer",
          "minimum": 1,
          "maximum": 4096
        },
        "maximumAffectedScopeRows": {
          "type": "integer",
          "minimum": 1,
          "maximum": 256
        },
        "maximumExternalIdentifiers": {
          "type": "integer",
          "minimum": 0,
          "maximum": 32
        },
        "maximumStringBytes": {
          "type": "integer",
          "minimum": 128,
          "maximum": 65536
        },
        "maximumProtectedAttachmentReferences": {
          "type": "integer",
          "minimum": 0,
          "maximum": 64
        },
        "maximumProtectedAttachmentBytes": {
          "type": "integer",
          "minimum": 0,
          "maximum": 67108864
        },
        "evaluationClockMaximumSkewSeconds": {
          "type": "integer",
          "minimum": 60,
          "maximum": 3600
        },
        "freshObservationMaximumAgeHours": {
          "type": "integer",
          "minimum": 1,
          "maximum": 24
        },
        "summaryMaximumAgeHours": {
          "type": "integer",
          "minimum": 1,
          "maximum": 24
        }
      }
    },
    "creditRules": {
      "type": "object",
      "additionalProperties": false,
      "required": [
        "consentRequired",
        "anonymousSupported",
        "maximumCreditLength",
        "authorizationMustBindExactText",
        "reporterCannotAuthorizeRelease"
      ],
      "properties": {
        "consentRequired": {
          "const": true
        },
        "anonymousSupported": {
          "const": true
        },
        "maximumCreditLength": {
          "type": "integer",
          "minimum": 1,
          "maximum": 256
        },
        "authorizationMustBindExactText": {
          "const": true
        },
        "reporterCannotAuthorizeRelease": {
          "const": true
        }
      }
    },
    "extensionPolicy": {
      "type": "object",
      "additionalProperties": false,
      "required": [
        "approverRoles",
        "reasonCodes",
        "nonExtendableCriticalDeadlines",
        "retroactiveExtensionsAllowed",
        "extensionsMaySuppressCriticalBlocker"
      ],
      "properties": {
        "approverRoles": {
          "$ref": "#/$defs/stringSet"
        },
        "reasonCodes": {
          "$ref": "#/$defs/stringSet"
        },
        "nonExtendableCriticalDeadlines": {
          "$ref": "#/$defs/stringSet"
        },
        "retroactiveExtensionsAllowed": {
          "const": false
        },
        "extensionsMaySuppressCriticalBlocker": {
          "const": false
        }
      }
    },
    "externalRules": {
      "type": "object",
      "additionalProperties": false,
      "required": [
        "systems",
        "allocationRequired",
        "actsAsReleaseAuthorization",
        "actsAsDisclosureAuthorization",
        "actsAsClosureAuthorization"
      ],
      "properties": {
        "systems": {
          "type": "array",
          "minItems": 4,
          "maxItems": 4,
          "uniqueItems": true,
          "items": {
            "enum": [
              "CVE",
              "GHSA",
              "OSV",
              "vendor"
            ]
          }
        },
        "allocationRequired": {
          "const": false
        },
        "actsAsReleaseAuthorization": {
          "const": false
        },
        "actsAsDisclosureAuthorization": {
          "const": false
        },
        "actsAsClosureAuthorization": {
          "const": false
        }
      }
    },
    "incidentEvidence": {
      "type": "object",
      "additionalProperties": false,
      "required": [
        "incidentClass",
        "requiredObligationTypes",
        "requiredEvidenceKinds"
      ],
      "properties": {
        "incidentClass": {
          "$ref": "stable-1.0-vulnerability-common-v1.schema.json#/$defs/referenceId"
        },
        "requiredObligationTypes": {
          "$ref": "#/$defs/stringSet"
        },
        "requiredEvidenceKinds": {
          "$ref": "#/$defs/stringSet"
        }
      }
    },
    "projectionRules": {
      "type": "object",
      "additionalProperties": false,
      "required": [
        "preDisclosureFields",
        "postDisclosureFields",
        "privateFieldsAlwaysExcluded",
        "generatedFromAllowlistOnly"
      ],
      "properties": {
        "preDisclosureFields": {
          "$ref": "#/$defs/stringSet"
        },
        "postDisclosureFields": {
          "$ref": "#/$defs/stringSet"
        },
        "privateFieldsAlwaysExcluded": {
          "$ref": "#/$defs/stringSet"
        },
        "generatedFromAllowlistOnly": {
          "const": true
        }
      }
    },
    "redactionRules": {
      "type": "object",
      "additionalProperties": false,
      "required": [
        "forbiddenCategories",
        "forbiddenPathSchemes",
        "forbiddenUriClasses",
        "scanEncodedRepresentations",
        "criticalFindingsWaivable"
      ],
      "properties": {
        "forbiddenCategories": {
          "$ref": "#/$defs/stringSet"
        },
        "forbiddenPathSchemes": {
          "$ref": "#/$defs/stringSet"
        },
        "forbiddenUriClasses": {
          "$ref": "#/$defs/stringSet"
        },
        "scanEncodedRepresentations": {
          "const": true
        },
        "criticalFindingsWaivable": {
          "const": false
        }
      }
    },
    "releaseLanePolicy": {
      "type": "object",
      "additionalProperties": false,
      "required": [
        "severity",
        "allowedLanes"
      ],
      "properties": {
        "severity": {
          "$ref": "stable-1.0-vulnerability-common-v1.schema.json#/$defs/strictSeverity"
        },
        "allowedLanes": {
          "type": "array",
          "minItems": 1,
          "maxItems": 2,
          "uniqueItems": true,
          "items": {
            "enum": [
              "routine-maintenance",
              "security-hotfix"
            ]
          }
        }
      }
    },
    "retentionRules": {
      "type": "object",
      "additionalProperties": false,
      "required": [
        "appendOnly",
        "terminalCasesRetained",
        "advisoryHistoryRetained",
        "withdrawalErasesConfirmedImpact",
        "duplicateCasesRemainIndependent"
      ],
      "properties": {
        "appendOnly": {
          "const": true
        },
        "terminalCasesRetained": {
          "const": true
        },
        "advisoryHistoryRetained": {
          "const": true
        },
        "withdrawalErasesConfirmedImpact": {
          "const": false
        },
        "duplicateCasesRemainIndependent": {
          "const": true
        }
      }
    },
    "severityPolicy": {
      "type": "object",
      "additionalProperties": false,
      "required": [
        "severity",
        "acknowledgementHours",
        "triageHours",
        "remediationDecisionHours",
        "targetPublicationHours",
        "reporterUpdateCadenceHours",
        "coordinatedDisclosureHours",
        "postReleaseObservationHours",
        "followUpClosureHours",
        "maximumExtensionHours",
        "maximumExtensionCount"
      ],
      "properties": {
        "severity": {
          "$ref": "stable-1.0-vulnerability-common-v1.schema.json#/$defs/strictSeverity"
        },
        "acknowledgementHours": {
          "type": "integer",
          "minimum": 1,
          "maximum": 720
        },
        "triageHours": {
          "type": "integer",
          "minimum": 1,
          "maximum": 720
        },
        "remediationDecisionHours": {
          "type": "integer",
          "minimum": 1,
          "maximum": 1440
        },
        "targetPublicationHours": {
          "type": "integer",
          "minimum": 1,
          "maximum": 8760
        },
        "reporterUpdateCadenceHours": {
          "type": "integer",
          "minimum": 1,
          "maximum": 1440
        },
        "coordinatedDisclosureHours": {
          "type": "integer",
          "minimum": 1,
          "maximum": 8760
        },
        "postReleaseObservationHours": {
          "type": "integer",
          "minimum": 1,
          "maximum": 720
        },
        "followUpClosureHours": {
          "type": "integer",
          "minimum": 1,
          "maximum": 2160
        },
        "maximumExtensionHours": {
          "type": "integer",
          "minimum": 0,
          "maximum": 2160
        },
        "maximumExtensionCount": {
          "type": "integer",
          "minimum": 0,
          "maximum": 8
        }
      }
    },
    "stringSet": {
      "type": "array",
      "maxItems": 128,
      "uniqueItems": true,
      "items": {
        "type": "string",
        "minLength": 1,
        "maxLength": 128
      }
    }
  }
}
