{
  "affectedScopeTypes": [
    "core-build",
    "package-key",
    "runtime-component",
    "wire-or-persistent-format",
    "platform-api-endpoint-or-capability",
    "first-party-app-version",
    "third-party-app-version",
    "catalog-id-and-edition",
    "content-format-profile",
    "reviewer-key",
    "app-signing-key",
    "catalog-signing-key",
    "update-signing-key",
    "support-bundle-or-redaction-path",
    "operator-or-web-shell-surface",
    "sandbox-or-apphost-boundary"
  ],
  "allowedReleaseLanes": [
    {
      "allowedLanes": [
        "routine-maintenance"
      ],
      "severity": "low"
    },
    {
      "allowedLanes": [
        "routine-maintenance"
      ],
      "severity": "moderate"
    },
    {
      "allowedLanes": [
        "routine-maintenance"
      ],
      "severity": "high"
    },
    {
      "allowedLanes": [
        "security-hotfix"
      ],
      "severity": "critical"
    }
  ],
  "artifactBounds": {
    "evaluationClockMaximumSkewSeconds": 300,
    "freshObservationMaximumAgeHours": 1,
    "maximumAffectedScopeRows": 256,
    "maximumCases": 4096,
    "maximumExternalIdentifiers": 32,
    "maximumLedgerBytes": 16777216,
    "maximumObligationsPerCase": 256,
    "maximumPostReleaseChecks": 4096,
    "maximumProtectedAttachmentBytes": 67108864,
    "maximumProtectedAttachmentReferences": 64,
    "maximumStringBytes": 8192,
    "maximumTransitionsPerCase": 128,
    "summaryMaximumAgeHours": 24
  },
  "caseStates": [
    "received",
    "acknowledged",
    "triaged",
    "accepted",
    "remediating",
    "release-scheduled",
    "fix-published",
    "disclosure-authorized",
    "disclosed",
    "post-release-verified",
    "closed",
    "duplicate",
    "not-security",
    "withdrawn"
  ],
  "closurePrerequisites": [
    "exact-fix-or-mitigation-publication-authenticated",
    "affected-and-fixed-scope-consistent",
    "authorized-advisory-published-and-freshly-observed",
    "required-catalog-actions-published",
    "required-key-actions-complete",
    "required-lifecycle-actions-complete",
    "updater-and-replacement-guidance-public",
    "release-completion-and-reconciliation-pass",
    "hotfix-follow-up-closed-or-authorized-successor",
    "surface-specific-post-release-checks-pass",
    "reporter-notifications-recorded-when-contact-exists",
    "reporter-credit-matches-consent",
    "no-overdue-critical-or-high-follow-up",
    "public-references-exact",
    "redaction-scan-pass"
  ],
  "confidenceVocabulary": [
    "unconfirmed",
    "suspected",
    "likely",
    "confirmed"
  ],
  "criticalRules": [
    "current-stable-confirmed-exploitable-routes-security-hotfix",
    "accepted-critical-case-remains-in-ledger",
    "overdue-critical-case-blocks-stable-promotion",
    "branch-fix-does-not-prove-publication",
    "signing-or-reviewer-key-incident-requires-independent-key-receipt",
    "lifecycle-revocation-is-separate-authority",
    "critical-redaction-finding-is-non-waivable",
    "critical-extension-cannot-be-indefinite"
  ],
  "disclosurePrerequisites": [
    "case-is-fix-published",
    "exact-pr-287-completion-authenticated",
    "exact-maintenance-or-hotfix-publication-authenticated",
    "fixed-bytes-publicly-observed",
    "required-catalog-lifecycle-key-actions-authenticated",
    "exact-advisory-bytes-redaction-pass",
    "exact-targets-and-window-authorized",
    "reporter-credit-consent-bound-when-present"
  ],
  "effectiveAt": "2026-07-30T00:00:00Z",
  "embargoStates": [
    "protected-embargoed",
    "public-safe-pre-disclosure",
    "disclosure-scheduled",
    "disclosure-authorized",
    "disclosed"
  ],
  "exploitabilityVocabulary": [
    "not-assessed",
    "theoretical",
    "reproduced-in-protected-test",
    "active-exploitation-suspected",
    "active-exploitation-confirmed"
  ],
  "extensionPolicy": {
    "approverRoles": [
      "stable-security-response-owner",
      "stable-vulnerability-triage-authorizer"
    ],
    "extensionsMaySuppressCriticalBlocker": false,
    "nonExtendableCriticalDeadlines": [
      "acknowledgementDueAt",
      "triageDueAt"
    ],
    "reasonCodes": [
      "coordinated-vendor-dependency",
      "safe-mitigation-deployed",
      "publication-window-coordination",
      "independent-reproduction-pending",
      "replacement-package-validation"
    ],
    "retroactiveExtensionsAllowed": false
  },
  "externalIdentifierRules": {
    "actsAsClosureAuthorization": false,
    "actsAsDisclosureAuthorization": false,
    "actsAsReleaseAuthorization": false,
    "allocationRequired": false,
    "systems": [
      "CVE",
      "GHSA",
      "OSV",
      "vendor"
    ]
  },
  "kind": "stable-1.0-vulnerability-disclosure-policy",
  "obligationTypes": [
    "stable-backport-fix-binding",
    "stable-maintenance-publication",
    "core-update-publication",
    "release-reconciliation",
    "hotfix-follow-up",
    "stable-lifecycle-transition",
    "catalog-advisory-publication",
    "app-version-denylist",
    "replacement-or-safe-uninstall-guidance",
    "reviewer-key-revocation",
    "review-receipt-revocation",
    "app-signing-key-revocation-or-rotation",
    "catalog-signing-key-rotation",
    "update-signing-key-revocation-or-rotation",
    "support-redaction-verification",
    "platform-api-compatibility-or-migration",
    "content-profile-compatibility-or-migration",
    "reporter-status-update",
    "reporter-disclosure-notification",
    "reporter-closure-notification",
    "advisory-publication-and-observation",
    "post-release-install-update",
    "post-release-rollback",
    "post-release-migration",
    "post-release-backup-restore"
  ],
  "policyDigest": "sha256:91057e20ea818cffeef97a582d61a87f5e7ca29a3660ca1b77298ac9a5399e08",
  "policyEdition": 1,
  "preTriageBlockingPolicy": {
    "deadlineNames": [
      "acknowledgementDueAt",
      "triageDueAt"
    ],
    "severities": [
      "high",
      "critical"
    ]
  },
  "publicProjectionRules": {
    "generatedFromAllowlistOnly": true,
    "postDisclosureFields": [
      "caseOpaqueId",
      "advisoryOpaqueId",
      "caseSnapshotDigest",
      "privateRecordDigest",
      "publicProjectionDigest",
      "policyDigest",
      "state",
      "embargoState",
      "severity",
      "publicTitle",
      "publicSummary",
      "affectedScope",
      "fixedOrMitigatedScope",
      "guidance",
      "externalIdentifiers",
      "reporterCredit",
      "publishedAt",
      "references",
      "verification"
    ],
    "preDisclosureFields": [
      "caseOpaqueId",
      "caseSnapshotDigest",
      "privateRecordDigest",
      "publicProjectionDigest",
      "policyDigest",
      "state",
      "embargoState",
      "verification"
    ],
    "privateFieldsAlwaysExcluded": [
      "reporter-contact",
      "reporter-reference",
      "private-report-summary",
      "reproduction-details",
      "protected-attachment-names",
      "private-issue-or-fork-url",
      "raw-patch-or-diff",
      "private-branch-or-unreleased-commit",
      "support-bundle-content",
      "raw-node-app-profile-feed-social-trust-data",
      "private-insert-uri",
      "credentials-or-private-keys",
      "local-paths",
      "internal-hosts-or-addresses",
      "private-publication-target"
    ]
  },
  "redactionRestrictions": {
    "criticalFindingsWaivable": false,
    "forbiddenCategories": [
      "reporter-contact",
      "private-url",
      "exploit-or-source-detail",
      "private-insert-uri",
      "private-key",
      "authorization",
      "cookie",
      "secret-assignment",
      "absolute-path",
      "windows-path",
      "internal-address",
      "sensitive-field"
    ],
    "forbiddenPathSchemes": [
      "absolute-posix",
      "absolute-windows",
      "unc",
      "file-uri",
      "parent-traversal"
    ],
    "forbiddenUriClasses": [
      "credential-bearing",
      "private-insert",
      "private-issue",
      "private-advisory",
      "private-fork",
      "loopback",
      "link-local",
      "private-address",
      "internal-hostname",
      "unreleased-package"
    ],
    "scanEncodedRepresentations": true
  },
  "reporterCreditRules": {
    "anonymousSupported": true,
    "authorizationMustBindExactText": true,
    "consentRequired": true,
    "maximumCreditLength": 256,
    "reporterCannotAuthorizeRelease": true
  },
  "repositoryIdentity": "github.com/crypta-network/cryptad",
  "requiredEvidenceByIncidentClass": [
    {
      "incidentClass": "core-build",
      "requiredEvidenceKinds": [
        "stable-backport-validation",
        "stable-backport-completion",
        "maintenance-publication-receipt",
        "core-update-publication-receipt"
      ],
      "requiredObligationTypes": [
        "stable-backport-fix-binding",
        "stable-maintenance-publication",
        "core-update-publication",
        "release-reconciliation",
        "post-release-install-update"
      ]
    },
    {
      "incidentClass": "app-or-catalog",
      "requiredEvidenceKinds": [
        "signed-catalog-security-receipt",
        "catalog-public-observation"
      ],
      "requiredObligationTypes": [
        "catalog-advisory-publication",
        "app-version-denylist",
        "replacement-or-safe-uninstall-guidance"
      ]
    },
    {
      "incidentClass": "reviewer-key",
      "requiredEvidenceKinds": [
        "reviewer-key-lifecycle-receipt",
        "review-receipt-revocation",
        "transparency-log-evidence"
      ],
      "requiredObligationTypes": [
        "reviewer-key-revocation",
        "review-receipt-revocation"
      ]
    },
    {
      "incidentClass": "signing-key",
      "requiredEvidenceKinds": [
        "key-revocation-or-rotation-receipt"
      ],
      "requiredObligationTypes": [
        "app-signing-key-revocation-or-rotation",
        "catalog-signing-key-rotation",
        "update-signing-key-revocation-or-rotation"
      ]
    },
    {
      "incidentClass": "support-redaction",
      "requiredEvidenceKinds": [